<?xml version="1.0"?>
<commands
    xmlns:xsi="http://www.w3.org/2001/XMLSchema-instance"
    xsi:noNamespaceSchemaLocation="commands.xsd">
    <commandChain name="chainName">
        <command name="instance1" path="" className="org.zerucus.command.samples.Sample" method="Constructor">
            <description>chainName [-param1] - description of param1
                -param1 - description of param1</description>
            <params>
                <param name="-param1" position="0" type="java.lang.String">Konstructor</param>
            </params>
        </command>
        <command name="instance2" path="" className="org.zerucus.command.samples.Sample" classInstance="instance1" method="objMethod">
            <description>chainName [-param1] - description of param1
                -param1 - description of param1</description>
            <params>
                <param name="-param2" position="0" type="java.lang.String">Klasa przekazana</param>
            </params>
        </command>
        <command name="instance3" path="" className="org.zerucus.command.samples.Sample" method="objMethod1">
            <description/>
            <params>
                <param name="i2" position="0" type="org.zerucus.command.samples.Sample">instance2</param>
            </params>
        </command>
    </commandChain>
</commands>