<?xml version="1.0"?>
<commands
xmlns:xsi="http://www.w3.org/2001/XMLSchema-instance"
xsi:noNamespaceSchemaLocation="commands.xsd">
<commandChain name="r1">
<command name="r1" path="" className="org.zerucus.command.Test" method="Constructor">
<description>r1 [-param1] - coś tam coś tam.
-param1 - coś tam coś tam</description>
   <params>
       <param name="-param1" position="0" type="java.lang.String">Konstructor</param>
       </params>
    </command>
 <command name="r2" path="" className="org.zerucus.command.Test" classInstance="r1" method="objMethod">
<description>r1 [-param1] - coś tam coś tam.
-param1 - coś tam coś tam</description>
     <params>
      <param name="-param2" position="0" type="java.lang.String">Klasa przekazana</param>
      </params>
 </command>
 <command name="r3" path="" className="org.zerucus.command.Test" classInstance="r2" method="objMethod1">
<description>r3</description>
     <params>
      <param name="r2" position="0" type="org.zerucus.command.Test">r2</param>
      </params>
 </command>
</commandChain>
</commands>