<?xml version="1.0"?>
<commands
    xmlns:xsi="http://www.w3.org/2001/XMLSchema-instance"
    xsi:noNamespaceSchemaLocation="commands.xsd">
    <commandChain name="chainName">
        <command instanceName="instance1" className="org.zerucus.command.samples.Sample" method="Constructor">
            <description>chainName [-param1] - description of param1
                -param1 - description of param1</description>
            <params>
                <param name="-param1" type="java.lang.String">"Konstructor"</param>
            </params>
        </command>
        <command instanceName="instance2" className="org.zerucus.command.samples.Sample" classInstance="instance1" method="objMethod">
            <description>chainName [-param1] - description of param1
                -param1 - description of param1</description>
            <params>
                <param name="-param2" type="java.lang.String">"Klasa przekazana"</param>
            </params>
        </command>
        <command className="org.zerucus.command.samples.Sample" classInstance="instance2" method="objMethod1">
            <description/>
            <params>
                <param name="i2" type="org.zerucus.command.samples.Sample">instance2</param>
            </params>
        </command>
        <command  className="org.zerucus.command.samples.Sample" classInstance="instance2" method="method4">
            <description/>
            <params>
                <param name="i2" type="java.lang.Integer">3</param>
            </params>
        </command>
        <command className="org.zerucus.command.samples.Sample" classInstance="instance2" method="method1">
            <description/>
            <params>
                <param name="i2" type="int">56</param>
            </params>
        </command>
    </commandChain>
</commands>